[
    {
        "timestamp": 1770775983,
        "media": [],
        "label_values": [
            {
                "label": "URL",
                "value": "https://www.instagram.com/reel/XXXXXXXXXXX/",
                "href": "https://www.instagram.com/reel/XXXXXXXXXXX/"
            },
            {
                "dict": [
                    {
                        "dict": [
                            {
                                "label": "URL",
                                "value": ""
                            },
                            {
                                "label": "Name",
                                "value": "Synthetic Foodblog"
                            },
                            {
                                "label": "Username",
                                "value": "synthetic_foodblog"
                            }
                        ],
                        "title": ""
                    }
                ],
                "title": "Owner"
            }
        ],
        "fbid": "18079916561048001"
    },
    {
        "timestamp": 1770683481,
        "media": [],
        "label_values": [
            {
                "label": "URL",
                "value": "https://www.instagram.com/p/YYYYYYYYYYY/",
                "href": "https://www.instagram.com/p/YYYYYYYYYYY/"
            },
            {
                "dict": [
                    {
                        "dict": [
                            {
                                "label": "URL",
                                "value": ""
                            },
                            {
                                "label": "Name",
                                "value": "Synthetic Traveler"
                            },
                            {
                                "label": "Username",
                                "value": "synthetic_traveler"
                            }
                        ],
                        "title": ""
                    }
                ],
                "title": "Owner"
            }
        ],
        "fbid": "18079916561048002"
    }
]